"file","instance","method","status","objective","lower_bound","upper_bound","gap","runtime_seconds","verifier_passed","certified_original_problem","incumbent_source","incumbent_source_detail","incumbent_import_attempted","incumbent_import_verified","incumbent_import_objective","incumbent_generation_method","incumbent_generation_time_seconds","frontier_min_interval_lower_bound","unresolved_intervals","open_nodes","result_file","notes"
"incumbent_v12_m1_average_strong.json","v12_m1_average","gcap-frontier","gcap_frontier_not_closed","0.369698924539","0.27793693221","0.369698924539","0.248207355332","39.3505337","True","False","BPC-owned strong","","False","False","0","strong","0.1527281","0.27793693221","1","1","E:\codes\ExactEBRP\results\optimization_update_round4\raw\incumbent_v12_m1_average_strong.json","parsed Hybrid GA text format; distances rebuilt from points at speed factor 1.5 | Gamma-frontier diagnostic covers Gini intervals with fixed-Gini interval branch-price trees. It reports optimal only if every relevant interval is closed or bound-fathomed and the aggregated lower bound reaches the incumbent. Each interval also uses the valid trivial bound objective>=G>=interval_floor and a final-inventory pickup/route/Gini relaxation bound when it solves. | Optimization flags: column_dominance=true, column_dominance_mode=exact, projection_bound=true, penalty_domain_tightening=true, movement_domain_tightening=true, movement_bound_audit=false, frontier_best_bound_scheduling=true, frontier_relaxation_cache=true, frontier_focused_min_lb_retry=true, support_duration_pruning=true, route_mask_support_duration_pruning=true, support_duration_min_pickup_rule=ceil_half_support, support_duration_max_subset_size=5, support_feasibility_oracle=false, gcap_pricing_columns=2, frontier_column_cache=false | BPC thread policy: requested_threads=1, bpc_workers=1, pricing_threads=1, parallel_frontier=false, parallel_nodes=false, hardware_concurrency=20; restricted-master CPLEX and inventory-bound CPLEX calls use one internal thread each | BPC-owned incumbent candidate greedy_mode_0 feasible=true, objective=0.412159, G=0.289091, P=0.820454 | BPC-owned single-route greedy column mode=0, vehicle=0, mask=2904, pickup=20, duration=3549.15 | BPC-owned incumbent candidate greedy_mode_1 feasible=true, objective=0.457872, G=0.315327, P=0.950302 | BPC-owned single-route greedy column mode=1, vehicle=0, mask=16, pickup=26, duration=3573.22 | BPC-owned incumbent candidate greedy_mode_2 feasible=true, objective=0.39308, G=0.251052, P=0.946855 | BPC-owned single-route greedy column mode=2, vehicle=0, mask=73, pickup=24, duration=3519.87 | BPC-owned incumbent candidate random_greedy_seed_15455989 feasible=true, objective=0.408038, G=0.26002, P=0.986786 | BPC-owned incumbent candidate random_greedy_seed_15465962 feasible=true, objective=0.394367, G=0.277978, P=0.775927 | BPC-owned incumbent candidate random_greedy_seed_15475935 feasible=true, objective=0.448992, G=0.299379, P=0.997415 | BPC-owned incumbent candidate random_greedy_seed_15485908 feasible=true, objective=0.391013, G=0.250881, P=0.934215 | BPC-owned incumbent candidate random_greedy_seed_15495881 feasible=true, objective=0.431315, G=0.287606, P=0.958058 | BPC-owned incumbent candidate random_greedy_seed_15505854 feasible=true, objective=0.433892, G=0.314874, P=0.793451 | BPC-owned local search start_0 pass=0 improved objective=0.457872, G=0.315327, P=0.950302 | BPC-owned local search start_0 pass=1 no improving relocate/resize/swap move, objective=0.457872 | BPC-owned incumbent candidate local_search_start_0 feasible=true, objective=0.457872, G=0.315327, P=0.950302 | BPC-owned local search start_1 pass=0 improved objective=0.387577, G=0.268387, P=0.794599 | BPC-owned local search start_1 pass=1 improved objective=0.383047, G=0.264633, P=0.789429 | BPC-owned local search start_1 pass=2 improved objective=0.379831, G=0.261934, P=0.785981 | BPC-owned local search start_1 pass=3 improved objective=0.375406, G=0.258284, P=0.78081 | BPC-owned local search start_1 pass=4 improved objective=0.369699, G=0.25206, P=0.784258 | BPC-owned local search start_1 pass=5 no improving relocate/resize/swap move, objective=0.369699 | BPC-owned incumbent candidate local_search_start_1 feasible=true, objective=0.369699, G=0.25206, P=0.784258 | BPC-owned local search start_2 pass=0 no improving relocate/resize/swap move, objective=0.457872 | BPC-owned incumbent candidate local_search_start_2 feasible=true, objective=0.457872, G=0.315327, P=0.950302 | BPC-owned local search start_3 pass=0 improved objective=0.392443, G=0.249639, P=0.952026 | BPC-owned local search start_3 pass=1 improved objective=0.385696, G=0.244961, P=0.938236 | BPC-owned local search start_3 pass=2 improved objective=0.384421, G=0.244332, P=0.933927 | BPC-owned local search start_3 pass=3 no improving relocate/resize/swap move, objective=0.384421 | BPC-owned incumbent candidate local_search_start_3 feasible=true, objective=0.384421, G=0.244332, P=0.933927 | BPC-owned local search start_4 pass=0 improved objective=0.400347, G=0.252631, P=0.984775 | BPC-owned local search start_4 pass=1 improved objective=0.396218, G=0.249881, P=0.975583 | BPC-owned local search start_4 pass=2 improved objective=0.389259, G=0.248006, P=0.941684 | BPC-owned local search start_4 pass=3 improved objective=0.388452, G=0.24875, P=0.931342 | BPC-owned local search start_4 pass=4 improved objective=0.384537, G=0.244534, P=0.933353 | BPC-owned local search start_4 pass=5 improved objective=0.381067, G=0.243606, P=0.916404 | BPC-owned incumbent candidate local_search_start_4 feasible=true, objective=0.381067, G=0.243606, P=0.916404 | BPC-owned local search start_5 pass=0 improved objective=0.39034, G=0.27533, P=0.766735 | BPC-owned local search start_5 pass=1 improved objective=0.389241, G=0.273197, P=0.773629 | BPC-owned local search start_5 pass=2 improved objective=0.387217, G=0.271862, P=0.769033 | BPC-owned local search start_5 pass=3 improved objective=0.382661, G=0.267953, P=0.764724 | BPC-owned local search start_5 pass=4 improved objective=0.378365, G=0.263484, P=0.765873 | BPC-owned local search start_5 pass=5 improved objective=0.377945, G=0.262461, P=0.769895 | BPC-owned incumbent candidate local_search_start_5 feasible=true, objective=0.377945, G=0.262461, P=0.769895 | BPC-owned local search summary: starts=6, tested_moves=5943 | BPC-owned route-column incumbent pool dominance applied: mode=exact, columns_dominated=0 | BPC-owned incumbent generator summary: mode=strong, found=true, objective=0.369699, G=0.25206, P=0.784258, pool_columns=13, pricing_calls=0, pricing_generated_columns=0, master_states=15, runtime=0.152702 | accepted BPC-owned strong incumbent for frontier cutoff only: objective=0.369699, G=0.252060, P=0.784258 | frontier cover range=[0,0.369699], intervals=2, incumbent_objective=0.369699, incumbent_G=0.25206, gini_max_possible=0.916667, relevant_gini_upper_for_improvement=0.369699, frontier_covers_all_improving_gini_values=true, range_scope=original_full_improving_range | interval 0 inventory relaxation: inventory-route-Gini cutoff relaxation infeasible; no incumbent-improving solution exists in this interval: interval=[0,0.184849], pickup_limit=30, route_visit_cuts=singletons+subsets_up_to_12, integer_inventory_relaxation=true, station_flow_conservation=true, depot_return_capacity=true, station_operation_capacity=true, station_operation_mode_cuts=true, nonzero_visit_operation_cuts=true, route_mask_duration_load_relaxation=true, route_mask_max_v=12, route_mask_support_duration_pruning=true, route_mask_count_before_support_duration=4095, route_mask_count_after_support_duration=4095, route_masks_removed_by_support_duration=0, route_mask_support_duration_max_removed_subset_size=0, incumbent_cutoff_bound=true, penalty_budget=2.46465949693, min_station_bikes=330, objective_lb=0.369699, lp=results\bound_work\regen_candidate_V12_M1_average_1781976372549319200_15729502191765196471\inventory_gini_bound.lp, bound_time=16.623666 | interval 0 bound-fathomed by final-inventory relaxation before branch-price tree | interval 1 inventory relaxation: inventory-route-Gini integer relaxation time-limited; using valid CPLEX MIP best bound: interval=[0.184849,0.369699], pickup_limit=30, route_visit_cuts=singletons+subsets_up_to_12, integer_inventory_relaxation=true, station_flow_conservation=true, depot_return_capacity=true, station_operation_capacity=true, station_operation_mode_cuts=true, nonzero_visit_operation_cuts=true, route_mask_duration_load_relaxation=true, route_mask_max_v=12, route_mask_support_duration_pruning=true, route_mask_count_before_support_duration=4095, route_mask_count_after_support_duration=4095, route_masks_removed_by_support_duration=0, route_mask_support_duration_max_removed_subset_size=0, incumbent_cutoff_bound=true, penalty_budget=1.23232974846, penalty_domain_tightening=true, domains_tightened=0, domain_width_before=479, domain_width_after=479, projection_bound_enabled=true, projection_bound_valid=true, projection_bound_lb=0.189288, projection_bound_scope=global, min_station_bikes=330, s_upper=22.7952, objective_lb=0.277937, status=time limit exceeded, lp=results\bound_work\regen_candidate_V12_M1_average_1781976389172998800_15729502191765196471\inventory_gini_bound.lp, bound_time=11.688489 | interval 1 [0.184849,0.369699] complete=false, lower_bound_valid=true, certified_by_bound=false, empty_interval=false, has_incumbent=true, tree_lb=0.189288, interval_lb=0.277937, inventory_relax_lb=0.277937, resource_lb=0.0727378, incumbent_metric=0.302488, incumbent_cutoff=0.369699, nodes=1, columns=584, pricing_calls=1, pricing_time=0.0028344, master_time=10.8701, bound_time=11.6885, cuts_added=0, open_nodes=1 | frontier_interval_ledger: interval_id=0, range=[0,0.184849], status=bound_fathomed, interval_lb=0.369699, cheap_prepass_lb=0.00515451, cheap_sources=gamma_floor|movement_domain|penalty_domain|projection_bound, lb_source=inventory_route_gini_relaxation, lb_sources=gamma_floor|cheap_projection_bound|inventory_route_gini_relaxation, complete_or_fathomed=true, open_nodes=0, pricing_closed=false | frontier_interval_ledger: interval_id=1, range=[0.184849,0.369699], status=unresolved, interval_lb=0.277937, cheap_prepass_lb=0.189288, cheap_sources=gamma_floor|movement_domain|penalty_domain|projection_bound, lb_source=inventory_route_gini_relaxation, lb_sources=gamma_floor|cheap_projection_bound|inventory_route_gini_relaxation|branch_price_tree, complete_or_fathomed=false, open_nodes=1, pricing_closed=true | frontier certification summary: closed_intervals=0, bound_certified_intervals=1, skipped_intervals=0, relevant_intervals=2, frontier_min_interval_lower_bound=0.277937, frontier_lower_bound_source=inventory_route_gini_relaxation, unresolved_intervals=1, invalid_bound_intervals=0, final_full_objective_range=true, frontier_range_certificate_scope=original_full_improving_range, relevant_gini_upper_for_improvement=0.369699, covered_gini_upper_bound=0.369699"
"incumbent_v12_m2_average_compact-cplex.json","v12_m2_average","gcap-frontier","gcap_frontier_not_closed","0.818577127342","0.61932789274","0.818577127342","0.243409237745","45.5179308","True","False","compact CPLEX seed","verified UB imported from compact-cplex seed; not lower-bound evidence","False","False","0","compact-cplex","12.1934037","0.61932789274","1","1","E:\codes\ExactEBRP\results\optimization_update_round4\raw\incumbent_v12_m2_average_compact-cplex.json","parsed Hybrid GA text format; distances rebuilt from points at speed factor 1.5 | Gamma-frontier diagnostic covers Gini intervals with fixed-Gini interval branch-price trees. It reports optimal only if every relevant interval is closed or bound-fathomed and the aggregated lower bound reaches the incumbent. Each interval also uses the valid trivial bound objective>=G>=interval_floor and a final-inventory pickup/route/Gini relaxation bound when it solves. | Optimization flags: column_dominance=true, column_dominance_mode=exact, projection_bound=true, penalty_domain_tightening=true, movement_domain_tightening=true, movement_bound_audit=false, frontier_best_bound_scheduling=true, frontier_relaxation_cache=true, frontier_focused_min_lb_retry=true, support_duration_pruning=true, route_mask_support_duration_pruning=true, support_duration_min_pickup_rule=ceil_half_support, support_duration_max_subset_size=5, support_feasibility_oracle=false, gcap_pricing_columns=2, frontier_column_cache=false | BPC thread policy: requested_threads=1, bpc_workers=1, pricing_threads=1, parallel_frontier=false, parallel_nodes=false, hardware_concurrency=20; restricted-master CPLEX and inventory-bound CPLEX calls use one internal thread each | BPC-owned route-column incumbent pool dominance applied: mode=exact, columns_dominated=0 | BPC-owned incumbent generator summary: mode=compact-cplex, found=true, objective=1.00822, G=0.670596, P=2.25085, pool_columns=0, pricing_calls=0, pricing_generated_columns=0, master_states=3, runtime=3.59e-05 | discarded BPC-owned compact-cplex incumbent: verified objective=1.008223 did not improve current incumbent=1.008223 | compact incumbent seed mode=compact-cplex, status=not_certified, objective=0.818577, runtime=12.1681, seed_time_limit=12 | accepted compact CPLEX seed incumbent for frontier cutoff only: objective=0.818577, G=0.524625, P=1.959680 | frontier cover range=[0,0.818577], intervals=2, incumbent_objective=0.818577, incumbent_G=0.524625, gini_max_possible=0.916667, relevant_gini_upper_for_improvement=0.818577, frontier_covers_all_improving_gini_values=true, range_scope=original_full_improving_range | interval 0 inventory relaxation: inventory-route-Gini cutoff relaxation infeasible; no incumbent-improving solution exists in this interval: interval=[0,0.409289], pickup_limit=60, route_visit_cuts=singletons+subsets_up_to_12, integer_inventory_relaxation=true, station_flow_conservation=true, depot_return_capacity=true, station_operation_capacity=true, station_operation_mode_cuts=true, nonzero_visit_operation_cuts=true, route_mask_duration_load_relaxation=true, route_mask_max_v=12, route_mask_support_duration_pruning=true, route_mask_count_before_support_duration=8190, route_mask_count_after_support_duration=8190, route_masks_removed_by_support_duration=0, route_mask_support_duration_max_removed_subset_size=0, incumbent_cutoff_bound=true, penalty_budget=5.45718084895, min_station_bikes=181, objective_lb=0.818577, lp=results\bound_work\regen_candidate_V12_M2_average_1781976795876048800_15729502191765196471\inventory_gini_bound.lp, bound_time=11.401609 | interval 0 bound-fathomed by final-inventory relaxation before branch-price tree | interval 1 inventory relaxation: inventory-route-Gini integer relaxation time-limited; using valid CPLEX MIP best bound: interval=[0.409289,0.818577], pickup_limit=60, route_visit_cuts=singletons+subsets_up_to_12, integer_inventory_relaxation=true, station_flow_conservation=true, depot_return_capacity=true, station_operation_capacity=true, station_operation_mode_cuts=true, nonzero_visit_operation_cuts=true, route_mask_duration_load_relaxation=true, route_mask_max_v=12, route_mask_support_duration_pruning=true, route_mask_count_before_support_duration=8190, route_mask_count_after_support_duration=8190, route_masks_removed_by_support_duration=0, route_mask_support_duration_max_removed_subset_size=0, incumbent_cutoff_bound=true, penalty_budget=2.72859042447, penalty_domain_tightening=true, domains_tightened=0, domain_width_before=472, domain_width_after=472, projection_bound_enabled=true, projection_bound_valid=true, projection_bound_lb=0.44036, projection_bound_scope=global, min_station_bikes=181, s_upper=58.4175, objective_lb=0.619328, status=time limit exceeded, lp=results\bound_work\regen_candidate_V12_M2_average_1781976807277674600_15729502191765196471\inventory_gini_bound.lp, bound_time=11.480021 | interval 1 [0.409289,0.818577] complete=false, lower_bound_valid=true, certified_by_bound=false, empty_interval=false, has_incumbent=true, tree_lb=0.44036, interval_lb=0.619328, inventory_relax_lb=0.619328, resource_lb=0.180148, incumbent_metric=0.703241, incumbent_cutoff=0.818577, nodes=1, columns=1006, pricing_calls=1, pricing_time=0.0027639, master_time=10.3987, bound_time=11.48, cuts_added=0, open_nodes=1 | frontier_interval_ledger: interval_id=0, range=[0,0.409289], status=bound_fathomed, interval_lb=0.818577, cheap_prepass_lb=0.065587, cheap_sources=gamma_floor|movement_domain|penalty_domain|projection_bound, lb_source=inventory_route_gini_relaxation, lb_sources=gamma_floor|cheap_projection_bound|inventory_route_gini_relaxation, complete_or_fathomed=true, open_nodes=0, pricing_closed=false | frontier_interval_ledger: interval_id=1, range=[0.409289,0.818577], status=unresolved, interval_lb=0.619328, cheap_prepass_lb=0.44036, cheap_sources=gamma_floor|movement_domain|penalty_domain|projection_bound, lb_source=inventory_route_gini_relaxation, lb_sources=gamma_floor|cheap_projection_bound|inventory_route_gini_relaxation|branch_price_tree, complete_or_fathomed=false, open_nodes=1, pricing_closed=true | frontier certification summary: closed_intervals=0, bound_certified_intervals=1, skipped_intervals=0, relevant_intervals=2, frontier_min_interval_lower_bound=0.619328, frontier_lower_bound_source=inventory_route_gini_relaxation, unresolved_intervals=1, invalid_bound_intervals=0, final_full_objective_range=true, frontier_range_certificate_scope=original_full_improving_range, relevant_gini_upper_for_improvement=0.818577, covered_gini_upper_bound=0.818577"
"incumbent_v12_m2_average_compact.json","v12_m2_average","gcap-frontier","gcap_frontier_not_closed","0.818577127342","0.61932789274","0.818577127342","0.243409237745","44.3465364","True","False","compact tailored seed","verified UB imported from compact seed; not lower-bound evidence","False","False","0","compact","12.196482","0.61932789274","1","1","E:\codes\ExactEBRP\results\optimization_update_round4\raw\incumbent_v12_m2_average_compact.json","parsed Hybrid GA text format; distances rebuilt from points at speed factor 1.5 | Gamma-frontier diagnostic covers Gini intervals with fixed-Gini interval branch-price trees. It reports optimal only if every relevant interval is closed or bound-fathomed and the aggregated lower bound reaches the incumbent. Each interval also uses the valid trivial bound objective>=G>=interval_floor and a final-inventory pickup/route/Gini relaxation bound when it solves. | Optimization flags: column_dominance=true, column_dominance_mode=exact, projection_bound=true, penalty_domain_tightening=true, movement_domain_tightening=true, movement_bound_audit=false, frontier_best_bound_scheduling=true, frontier_relaxation_cache=true, frontier_focused_min_lb_retry=true, support_duration_pruning=true, route_mask_support_duration_pruning=true, support_duration_min_pickup_rule=ceil_half_support, support_duration_max_subset_size=5, support_feasibility_oracle=false, gcap_pricing_columns=2, frontier_column_cache=false | BPC thread policy: requested_threads=1, bpc_workers=1, pricing_threads=1, parallel_frontier=false, parallel_nodes=false, hardware_concurrency=20; restricted-master CPLEX and inventory-bound CPLEX calls use one internal thread each | BPC-owned route-column incumbent pool dominance applied: mode=exact, columns_dominated=0 | BPC-owned incumbent generator summary: mode=compact, found=true, objective=1.00822, G=0.670596, P=2.25085, pool_columns=0, pricing_calls=0, pricing_generated_columns=0, master_states=3, runtime=3.58e-05 | discarded BPC-owned compact incumbent: verified objective=1.008223 did not improve current incumbent=1.008223 | compact incumbent seed mode=compact, status=not_certified, objective=0.818577, runtime=12.1964, seed_time_limit=12 | accepted compact tailored seed incumbent for frontier cutoff only: objective=0.818577, G=0.524625, P=1.959680 | frontier cover range=[0,0.818577], intervals=2, incumbent_objective=0.818577, incumbent_G=0.524625, gini_max_possible=0.916667, relevant_gini_upper_for_improvement=0.818577, frontier_covers_all_improving_gini_values=true, range_scope=original_full_improving_range | interval 0 inventory relaxation: inventory-route-Gini cutoff relaxation infeasible; no incumbent-improving solution exists in this interval: interval=[0,0.409289], pickup_limit=60, route_visit_cuts=singletons+subsets_up_to_12, integer_inventory_relaxation=true, station_flow_conservation=true, depot_return_capacity=true, station_operation_capacity=true, station_operation_mode_cuts=true, nonzero_visit_operation_cuts=true, route_mask_duration_load_relaxation=true, route_mask_max_v=12, route_mask_support_duration_pruning=true, route_mask_count_before_support_duration=8190, route_mask_count_after_support_duration=8190, route_masks_removed_by_support_duration=0, route_mask_support_duration_max_removed_subset_size=0, incumbent_cutoff_bound=true, penalty_budget=5.45718084895, min_station_bikes=181, objective_lb=0.818577, lp=results\bound_work\regen_candidate_V12_M2_average_1781976751514941200_15729502191765196471\inventory_gini_bound.lp, bound_time=11.061739 | interval 0 bound-fathomed by final-inventory relaxation before branch-price tree | interval 1 inventory relaxation: inventory-route-Gini integer relaxation time-limited; using valid CPLEX MIP best bound: interval=[0.409289,0.818577], pickup_limit=60, route_visit_cuts=singletons+subsets_up_to_12, integer_inventory_relaxation=true, station_flow_conservation=true, depot_return_capacity=true, station_operation_capacity=true, station_operation_mode_cuts=true, nonzero_visit_operation_cuts=true, route_mask_duration_load_relaxation=true, route_mask_max_v=12, route_mask_support_duration_pruning=true, route_mask_count_before_support_duration=8190, route_mask_count_after_support_duration=8190, route_masks_removed_by_support_duration=0, route_mask_support_duration_max_removed_subset_size=0, incumbent_cutoff_bound=true, penalty_budget=2.72859042447, penalty_domain_tightening=true, domains_tightened=0, domain_width_before=472, domain_width_after=472, projection_bound_enabled=true, projection_bound_valid=true, projection_bound_lb=0.44036, projection_bound_scope=global, min_station_bikes=181, s_upper=58.4175, objective_lb=0.619328, status=time limit exceeded, lp=results\bound_work\regen_candidate_V12_M2_average_1781976762576706900_15729502191765196471\inventory_gini_bound.lp, bound_time=11.064303 | interval 1 [0.409289,0.818577] complete=false, lower_bound_valid=true, certified_by_bound=false, empty_interval=false, has_incumbent=true, tree_lb=0.44036, interval_lb=0.619328, inventory_relax_lb=0.619328, resource_lb=0.180148, incumbent_metric=0.703241, incumbent_cutoff=0.818577, nodes=1, columns=1006, pricing_calls=1, pricing_time=0.001753, master_time=9.98348, bound_time=11.0643, cuts_added=0, open_nodes=1 | frontier_interval_ledger: interval_id=0, range=[0,0.409289], status=bound_fathomed, interval_lb=0.818577, cheap_prepass_lb=0.065587, cheap_sources=gamma_floor|movement_domain|penalty_domain|projection_bound, lb_source=inventory_route_gini_relaxation, lb_sources=gamma_floor|cheap_projection_bound|inventory_route_gini_relaxation, complete_or_fathomed=true, open_nodes=0, pricing_closed=false | frontier_interval_ledger: interval_id=1, range=[0.409289,0.818577], status=unresolved, interval_lb=0.619328, cheap_prepass_lb=0.44036, cheap_sources=gamma_floor|movement_domain|penalty_domain|projection_bound, lb_source=inventory_route_gini_relaxation, lb_sources=gamma_floor|cheap_projection_bound|inventory_route_gini_relaxation|branch_price_tree, complete_or_fathomed=false, open_nodes=1, pricing_closed=true | frontier certification summary: closed_intervals=0, bound_certified_intervals=1, skipped_intervals=0, relevant_intervals=2, frontier_min_interval_lower_bound=0.619328, frontier_lower_bound_source=inventory_route_gini_relaxation, unresolved_intervals=1, invalid_bound_intervals=0, final_full_objective_range=true, frontier_range_certificate_scope=original_full_improving_range, relevant_gini_upper_for_improvement=0.818577, covered_gini_upper_bound=0.818577"
